Sheet: Sheet1
B2: (1) | C2: (2) | D2: (3) | E2: (4) | F2: (5) | G2: (6)
A3: VARIABLES | B3: temp | C3: temp | D3: temp | E3: temp | F3: temp | G3: temp
A4: 0bn.treatment#c.guessbid | B4: 0.204 | C4: 0.232 | D4: 0.150 | E4: -0.00652 | F4: -0.0671 | G4: -0.0638
B5: [0.690] | C5: [0.672] | D5: [0.785] | E5: [0.972] | F5: [0.794] | G5: [0.802]
A6: 1.treatment#c.guessbid | B6: -0.288 | C6: -0.240 | D6: -0.166 | E6: -0.0864 | F6: -0.318 | G6: -0.321
B7: [0.613] | C7: [0.662] | D7: [0.774] | E7: [0.661] | F7: [0.262] | G7: [0.280]
A8: 2.treatment#c.guessbid | B8: 0.122 | C8: -1.507 | D8: -1.030 | E8: -0.665 | F8: -0.660 | G8: -0.682
B9: [0.748] | C9: [0.0526] | D9: [0.325] | E9: [0.000141] | F9: [0.000319] | G9: [0.000176]
A10: 3.treatment#c.guessbid | B10: -0.124 | C10: 0.279 | D10: 0.222 | E10: -0.0699 | F10: -0.157 | G10: -0.280
B11: [0.786] | C11: [0.597] | D11: [0.668] | E11: [0.718] | F11: [0.540] | G11: [0.276]
A12: 11.treatment#c.guessbid | B12: 0.597 | C12: 0.584 | D12: 0.619 | E12: -0.0593 | F12: -0.0288 | G12: -0.0255
B13: [0.422] | C13: [0.439] | D13: [0.405] | E13: [0.792] | F13: [0.902] | G13: [0.912]
A14: 21.treatment#c.guessbid | B14: -0.561 | C14: -0.505 | D14: -0.0192 | E14: -0.140 | F14: -0.340 | G14: -0.348
B15: [0.115] | C15: [0.224] | D15: [0.968] | E15: [0.574] | F15: [0.215] | G15: [0.207]
A16: 22.treatment#c.guessbid | B16: 0.378 | C16: 0.546 | D16: 0.303 | E16: 0.239 | F16: 0.155 | G16: 0.132
B17: [0.441] | C17: [0.282] | D17: [0.557] | E17: [0.235] | F17: [0.507] | G17: [0.582]
A18: 0bn.treatment#c.guesscost | C18: -1.041 | D18: -0.946 | F18: -0.913 | G18: -0.903
C19: [0.00380] | D19: [0.0130] | F19: [0.000443] | G19: [0.000500]
A20: 1.treatment#c.guesscost | C20: -1.615 | D20: -1.626 | F20: -0.646 | G20: -0.643
C21: [2.95e-07] | D21: [2.24e-07] | F21: [0.0382] | G21: [0.0454]
A22: 2.treatment#c.guesscost | C22: 0.663 | D22: 0.507 | F22: -1.016 | G22: -0.990
C23: [0.337] | D23: [0.479] | F23: [1.73e-08] | G23: [2.93e-08]
A24: 3.treatment#c.guesscost | C24: -1.714 | D24: -1.909 | F24: -0.890 | G24: -0.975
C25: [0.00131] | D25: [0.000441] | F25: [3.09e-05] | G25: [5.06e-06]
A26: 11.treatment#c.guesscost | C26: -0.968 | D26: -0.854 | F26: -1.098 | G26: -1.127
C27: [0.0709] | D27: [0.138] | F27: [2.38e-07] | G27: [2.75e-07]
A28: 21.treatment#c.guesscost | C28: -1.129 | D28: -2.064 | F28: -0.596 | G28: -0.606
C29: [0.0409] | D29: [0.00629] | F29: [0.0102] | G29: [0.0106]
A30: 22.treatment#c.guesscost | C30: -1.531 | D30: -1.346 | F30: -0.836 | G30: -0.852
C31: [0.00770] | D31: [0.0186] | F31: [0.000302] | G31: [0.000260]
A32: 0bn.treatment#c.payoff | D32: -0.748 | G32: -1.054
D33: [0.0554] | G33: [6.73e-08]
A34: 1.treatment#c.payoff | D34: -1.133 | G34: -0.994
D35: [0.00401] | G35: [7.25e-07]
A36: 2.treatment#c.payoff | D36: -1.405 | G36: -0.622
D37: [0.0240] | G37: [0.000888]
A38: 3.treatment#c.payoff | D38: -0.399 | G38: -0.399
D39: [0.288] | G39: [0.0421]
A40: 11.treatment#c.payoff | D40: -1.193 | G40: -0.908
D41: [0.00370] | G41: [4.00e-06]
A42: 21.treatment#c.payoff | D42: 0.110 | G42: -0.967
D43: [0.854] | G43: [2.15e-06]
A44: 22.treatment#c.payoff | D44: -0.361 | G44: -0.927
D45: [0.331] | G45: [9.17e-06]
A47: Observations | B47: 100 | C47: 100 | D47: 100 | E47: 315 | F47: 315 | G47: 315
A48: R-squared | B48: 0.103 | C48: 0.841 | D48: 0.959 | E48: 0.073 | F48: 0.854 | G48: 0.960

Sheet: Sheet2
A2: =Sheet1!RC ->  | B2: =Sheet1!RC -> (1) | C2: =Sheet1!RC -> (2) | D2: =Sheet1!RC -> (3) | E2: =Sheet1!RC -> (4) | F2: =Sheet1!RC -> (5) | G2: =Sheet1!RC -> (6)
A3: =Sheet1!RC -> VARIABLES | B3: =Sheet1!RC -> temp | C3: =Sheet1!RC -> temp | D3: =Sheet1!RC -> temp | E3: =Sheet1!RC -> temp | F3: =Sheet1!RC -> temp | G3: =Sheet1!RC -> temp
A4: PPM (no rebate)*guessbid | B4: =Sheet1!RC+1 -> 1.204 | C4: =Sheet1!RC+1 -> 1.232 | D4: =Sheet1!RC+1 -> 1.1499999999999999 | E4: =Sheet1!RC+1 -> 0.99348000000000003 | F4: =Sheet1!RC+1 -> 0.93289999999999995 | G4: =Sheet1!RC+1 -> 0.93620000000000003
B5: =Sheet1!RC -> [0.690] | C5: =Sheet1!RC -> [0.672] | D5: =Sheet1!RC -> [0.785] | E5: =Sheet1!RC -> [0.972] | F5: =Sheet1!RC -> [0.794] | G5: =Sheet1!RC -> [0.802]
A6: WTA_uniform_allmember | B6: =Sheet1!RC+1 -> 0.71199999999999997 | C6: =Sheet1!RC+1 -> 0.76 | D6: =Sheet1!RC+1 -> 0.83399999999999996 | E6: =Sheet1!RC+1 -> 0.91359999999999997 | F6: =Sheet1!RC+1 -> 0.68199999999999994 | G6: =Sheet1!RC+1 -> 0.67900000000000005
A7: *guessbid | B7: =Sheet1!RC -> [0.613] | C7: =Sheet1!RC -> [0.662] | D7: =Sheet1!RC -> [0.774] | E7: =Sheet1!RC -> [0.661] | F7: =Sheet1!RC -> [0.262] | G7: =Sheet1!RC -> [0.280]
A8: WTA_uniform_allcontributor | B8: =Sheet1!RC+1 -> 1.1219999999999999 | C8: =Sheet1!RC+1 -> -0.5069999999999999 | D8: =Sheet1!RC+1 -> -3.0000000000000027E-2 | E8: =Sheet1!RC+1 -> 0.33499999999999996 | F8: =Sheet1!RC+1 -> 0.33999999999999997 | G8: =Sheet1!RC+1 -> 0.31799999999999995
A9: *guessbid | B9: =Sheet1!RC -> [0.748] | C9: =Sheet1!RC -> [0.0526] | D9: =Sheet1!RC -> [0.325] | E9: =Sheet1!RC -> [0.000141] | F9: =Sheet1!RC -> [0.000319] | G9: =Sheet1!RC -> [0.000176]
A10: WTA_proportional*guessbid | B10: =Sheet1!RC+1 -> 0.876 | C10: =Sheet1!RC+1 -> 1.2789999999999999 | D10: =Sheet1!RC+1 -> 1.222 | E10: =Sheet1!RC+1 -> 0.93010000000000004 | F10: =Sheet1!RC+1 -> 0.84299999999999997 | G10: =Sheet1!RC+1 -> 0.72
B11: =Sheet1!RC -> [0.786] | C11: =Sheet1!RC -> [0.597] | D11: =Sheet1!RC -> [0.668] | E11: =Sheet1!RC -> [0.718] | F11: =Sheet1!RC -> [0.540] | G11: =Sheet1!RC -> [0.276]
A12: Proportional*guessbid | B12: =Sheet1!RC+1 -> 1.597 | C12: =Sheet1!RC+1 -> 1.5840000000000001 | D12: =Sheet1!RC+1 -> 1.619 | E12: =Sheet1!RC+1 -> 0.94069999999999998 | F12: =Sheet1!RC+1 -> 0.97119999999999995 | G12: =Sheet1!RC+1 -> 0.97450000000000003
B13: =Sheet1!RC -> [0.422] | C13: =Sheet1!RC -> [0.439] | D13: =Sheet1!RC -> [0.405] | E13: =Sheet1!RC -> [0.792] | F13: =Sheet1!RC -> [0.902] | G13: =Sheet1!RC -> [0.912]
A14: UPA*guessbid | B14: =Sheet1!RC+1 -> 0.43899999999999995 | C14: =Sheet1!RC+1 -> 0.495 | D14: =Sheet1!RC+1 -> 0.98080000000000001 | E14: =Sheet1!RC+1 -> 0.86 | F14: =Sheet1!RC+1 -> 0.65999999999999992 | G14: =Sheet1!RC+1 -> 0.65200000000000002
B15: =Sheet1!RC -> [0.115] | C15: =Sheet1!RC -> [0.224] | D15: =Sheet1!RC -> [0.968] | E15: =Sheet1!RC -> [0.574] | F15: =Sheet1!RC -> [0.215] | G15: =Sheet1!RC -> [0.207]
A16: UPC*guessbid | B16: =Sheet1!RC+1 -> 1.3780000000000001 | C16: =Sheet1!RC+1 -> 1.546 | D16: =Sheet1!RC+1 -> 1.3029999999999999 | E16: =Sheet1!RC+1 -> 1.2389999999999999 | F16: =Sheet1!RC+1 -> 1.155 | G16: =Sheet1!RC+1 -> 1.1320000000000001
B17: =Sheet1!RC -> [0.441] | C17: =Sheet1!RC -> [0.282] | D17: =Sheet1!RC -> [0.557] | E17: =Sheet1!RC -> [0.235] | F17: =Sheet1!RC -> [0.507] | G17: =Sheet1!RC -> [0.582]
A18: PPM (no rebate)*guesscos | C18: =Sheet1!RC+1 -> -4.0999999999999925E-2 | D18: =Sheet1!RC+1 -> 5.4000000000000048E-2 | F18: =Sheet1!RC+1 -> 8.6999999999999966E-2 | G18: =Sheet1!RC+1 -> 9.6999999999999975E-2
C19: =Sheet1!RC -> [0.00380] | D19: =Sheet1!RC -> [0.0130] | F19: =Sheet1!RC -> [0.000443] | G19: =Sheet1!RC -> [0.000500]
A20: WTA_uniform_allmember | C20: =Sheet1!RC+1 -> -0.61499999999999999 | D20: =Sheet1!RC+1 -> -0.62599999999999989 | F20: =Sheet1!RC+1 -> 0.35399999999999998 | G20: =Sheet1!RC+1 -> 0.35699999999999998
A21: *guesscost | C21: =Sheet1!RC -> [2.95e-07] | D21: =Sheet1!RC -> [2.24e-07] | F21: =Sheet1!RC -> [0.0382] | G21: =Sheet1!RC -> [0.0454]
A22: WTA_uniform_allcontributor | C22: =Sheet1!RC+1 -> 1.663 | D22: =Sheet1!RC+1 -> 1.5070000000000001 | F22: =Sheet1!RC+1 -> -1.6000000000000014E-2 | G22: =Sheet1!RC+1 -> 1.0000000000000009E-2
A23: *guesscost | C23: =Sheet1!RC -> [0.337] | D23: =Sheet1!RC -> [0.479] | F23: =Sheet1!RC -> [1.73e-08] | G23: =Sheet1!RC -> [2.93e-08]
A24: WTA_proportional*guesscost | C24: =Sheet1!RC+1 -> -0.71399999999999997 | D24: =Sheet1!RC+1 -> -0.90900000000000003 | F24: =Sheet1!RC+1 -> 0.10999999999999999 | G24: =Sheet1!RC+1 -> 2.5000000000000022E-2
C25: =Sheet1!RC -> [0.00131] | D25: =Sheet1!RC -> [0.000441] | F25: =Sheet1!RC -> [3.09e-05] | G25: =Sheet1!RC -> [5.06e-06]
A26: Proportional*guesscost | C26: =Sheet1!RC+1 -> 3.2000000000000028E-2 | D26: =Sheet1!RC+1 -> 0.14600000000000002 | F26: =Sheet1!RC+1 -> -9.8000000000000087E-2 | G26: =Sheet1!RC+1 -> -0.127
C27: =Sheet1!RC -> [0.0709] | D27: =Sheet1!RC -> [0.138] | F27: =Sheet1!RC -> [2.38e-07] | G27: =Sheet1!RC -> [2.75e-07]
A28: UPA*guesscost | C28: =Sheet1!RC+1 -> -0.129 | D28: =Sheet1!RC+1 -> -1.0640000000000001 | F28: =Sheet1!RC+1 -> 0.40400000000000003 | G28: =Sheet1!RC+1 -> 0.39400000000000002
C29: =Sheet1!RC -> [0.0409] | D29: =Sheet1!RC -> [0.00629] | F29: =Sheet1!RC -> [0.0102] | G29: =Sheet1!RC -> [0.0106]
A30: UPC*guesscost | C30: =Sheet1!RC+1 -> -0.53099999999999992 | D30: =Sheet1!RC+1 -> -0.34600000000000009 | F30: =Sheet1!RC+1 -> 0.16400000000000003 | G30: =Sheet1!RC+1 -> 0.14800000000000002
A31: =Sheet1!RC ->  | B31: =Sheet1!RC ->  | C31: =Sheet1!RC -> [0.00770] | D31: =Sheet1!RC -> [0.0186] | E31: =Sheet1!RC ->  | F31: =Sheet1!RC -> [0.000302] | G31: =Sheet1!RC -> [0.000260]
A32: PPM (no rebate)*payoff | B32: =Sheet1!RC ->  | C32: =Sheet1!RC ->  | D32: =Sheet1!RC+1 -> 0.252 | E32: =Sheet1!RC ->  | F32: =Sheet1!RC ->  | G32: =Sheet1!RC+1 -> -5.4000000000000048E-2
B33: =Sheet1!RC ->  | C33: =Sheet1!RC ->  | D33: =Sheet1!RC -> [0.0554] | E33: =Sheet1!RC ->  | F33: =Sheet1!RC ->  | G33: =Sheet1!RC -> [6.73e-08]
A34: WTA_uniform_allmember | B34: =Sheet1!RC ->  | C34: =Sheet1!RC ->  | D34: =Sheet1!RC+1 -> -0.13300000000000001 | E34: =Sheet1!RC ->  | F34: =Sheet1!RC ->  | G34: =Sheet1!RC+1 -> 6.0000000000000053E-3
A35: *payoff | B35: =Sheet1!RC ->  | C35: =Sheet1!RC ->  | D35: =Sheet1!RC -> [0.00401] | E35: =Sheet1!RC ->  | F35: =Sheet1!RC ->  | G35: =Sheet1!RC -> [7.25e-07]
A36: WTA_uniform_allcontributor | B36: =Sheet1!RC ->  | C36: =Sheet1!RC ->  | D36: =Sheet1!RC+1 -> -0.40500000000000003 | E36: =Sheet1!RC ->  | F36: =Sheet1!RC ->  | G36: =Sheet1!RC+1 -> 0.378
A37: *payoff | B37: =Sheet1!RC ->  | C37: =Sheet1!RC ->  | D37: =Sheet1!RC -> [0.0240] | E37: =Sheet1!RC ->  | F37: =Sheet1!RC ->  | G37: =Sheet1!RC -> [0.000888]
A38: WTA_proportional*payoff | B38: =Sheet1!RC ->  | C38: =Sheet1!RC ->  | D38: =Sheet1!RC+1 -> 0.60099999999999998 | E38: =Sheet1!RC ->  | F38: =Sheet1!RC ->  | G38: =Sheet1!RC+1 -> 0.60099999999999998
B39: =Sheet1!RC ->  | C39: =Sheet1!RC ->  | D39: =Sheet1!RC -> [0.288] | E39: =Sheet1!RC ->  | F39: =Sheet1!RC ->  | G39: =Sheet1!RC -> [0.0421]
A40: Proportional*payoff | B40: =Sheet1!RC ->  | C40: =Sheet1!RC ->  | D40: =Sheet1!RC+1 -> -0.19300000000000006 | E40: =Sheet1!RC ->  | F40: =Sheet1!RC ->  | G40: =Sheet1!RC+1 -> 9.1999999999999971E-2
B41: =Sheet1!RC ->  | C41: =Sheet1!RC ->  | D41: =Sheet1!RC -> [0.00370] | E41: =Sheet1!RC ->  | F41: =Sheet1!RC ->  | G41: =Sheet1!RC -> [4.00e-06]
A42: UPA*payoff | B42: =Sheet1!RC ->  | C42: =Sheet1!RC ->  | D42: =Sheet1!RC+1 -> 1.1100000000000001 | E42: =Sheet1!RC ->  | F42: =Sheet1!RC ->  | G42: =Sheet1!RC+1 -> 3.3000000000000029E-2
B43: =Sheet1!RC ->  | C43: =Sheet1!RC ->  | D43: =Sheet1!RC -> [0.854] | E43: =Sheet1!RC ->  | F43: =Sheet1!RC ->  | G43: =Sheet1!RC -> [2.15e-06]
A44: UPC*payoff | B44: =Sheet1!RC ->  | C44: =Sheet1!RC ->  | D44: =Sheet1!RC+1 -> 0.63900000000000001 | E44: =Sheet1!RC ->  | F44: =Sheet1!RC ->  | G44: =Sheet1!RC+1 -> 7.2999999999999954E-2
A45: =Sheet1!RC ->  | B45: =Sheet1!RC ->  | C45: =Sheet1!RC ->  | D45: =Sheet1!RC -> [0.331] | E45: =Sheet1!RC ->  | F45: =Sheet1!RC ->  | G45: =Sheet1!RC -> [9.17e-06]
A46: =Sheet1!RC ->  | B46: =Sheet1!RC ->  | C46: =Sheet1!RC ->  | D46: =Sheet1!RC ->  | E46: =Sheet1!RC ->  | F46: =Sheet1!RC ->  | G46: =Sheet1!RC -> 
A47: =Sheet1!RC -> Observations | B47: =Sheet1!RC -> 100 | C47: =Sheet1!RC -> 100 | D47: =Sheet1!RC -> 100 | E47: =Sheet1!RC -> 315 | F47: =Sheet1!RC -> 315 | G47: =Sheet1!RC -> 315
A48: =Sheet1!RC -> R-squared | B48: =Sheet1!RC -> 0.103 | C48: =Sheet1!RC -> 0.841 | D48: =Sheet1!RC -> 0.959 | E48: =Sheet1!RC -> 0.073 | F48: =Sheet1!RC -> 0.854 | G48: =Sheet1!RC -> 0.960